<?xml version="1.0"?>
<!DOCTYPE citydrain SYSTEM "../dtd/model.dtd">

<citydrain version="1.0">

	<pluginpath path="nodes" />
	<pythonmodule module="cdtest" />
	<pythonmodule module="testnodes" />

	<simulation class="DefaultSimulation">
		<time start="0" stop="72000" dt="300" />
		<flowdefinition>
		    <flow name="Q" />
            <concentration name="C0" />
            <concentration name="C1" />
		</flowdefinition>
	</simulation>

	<model>
		<nodelist>
			<node id="constsource1" class="RandomCatchment"/>
			<node id="constsource2" class="RandomCatchment"/>
			<node id="constsource3" class="RandomCatchment"/>
			
			<node id="fileout" class="FileOut">
				<parameter name="out_file_name" type="string" 
						value="tmp/test-random.txt" />
			</node>
			
			<node id="mixer" class="PyMixer">
			    <parameter name="count" type="int" value="3" />
			</node>
			
			<node id="musk1" class="Sewer" />
			
			<node id="pynode" class="MichiPythonNode">
				<parameter name="x" type="int" value="42"/>
			</node>
			
		</nodelist>
		
		<connectionlist>
		
			<connection id="con1">
				<source node="constsource1" port="out" />
				<sink	node="mixer" port="in0" />
			</connection>

			<connection id="con4">
				<source node="constsource2" port="out" />
				<sink	node="mixer" port="in1" />
			</connection>
			
			<connection id="con6">
				<source node="constsource3" port="out" />
				<sink	node="mixer" port="in2" />
			</connection>
			
			
            <connection id="con5">
				<source node="mixer" port="out" />
				<sink	node="musk1" port="in" />
			</connection>
			
			<connection id="con3">
				<source node="musk1" port="out" />
				<sink node="pynode" port="in" />
			</connection>
			
			<connection id="con2">
				<source node="pynode" port="out" />
				<sink node="fileout" port="in" />
			</connection>
			
		</connectionlist>
	</model>
</citydrain>
