<?xml version="1.0"?>
<!DOCTYPE citydrain SYSTEM "../dtd/model.dtd">

<citydrain version="1.0">

	<pluginpath path="nodes" />
	<pythonmodule module="cdtest" />
	<pythonmodule module="testnodes" />

	<simulation class="DefaultSimulation">
		<time start="0" stop="72000" dt="300" />
		<flowdefinition>
		    <flow name="Q" />
            <concentration name="C0" />
            <concentration name="C1" />
		</flowdefinition>
	</simulation>

	<model>
		<nodelist>
			<node id="constsource1" class="RandomCatchment"/>
			
			<node id="fileout" class="PyOut">
				<parameter name="out" type="string" 
						value="tmp/test-random.txt" />
			</node>
		</nodelist>
		
		<connectionlist>
		
			<connection id="con1">
				<source node="constsource1" port="out" />
				<sink	node="fileout" port="in" />
			</connection>
		</connectionlist>
	</model>
</citydrain>
