<?xml version="1.0"?>
<!DOCTYPE citydrain SYSTEM "../dtd/model.dtd">

<citydrain version="1.0">

	<pluginpath path="nodes" />

	<simulation class="DefaultSimulation">
		<time start="2009-Jan-01 00:00:00.00" stop="2010-Jan-01 00:00:00.00" dt="300" />
		<flowdefinition>
		    <flow name="Q"/>
		    <concentration name="C0"/>
		    <concentration name="C1"/>
		    <concentration name="C2"/>
		</flowdefinition>
	</simulation>

	<model>
		<nodelist>
			<node id="constsource" class="ConstSource">
				<parameter name="const_flow" kind="complex" type="Flow">
					<flow>
						<unit name="Q" value="234.0" />
						<unit name="C0" value="0.1"/>
						<unit name="C1" value="0.2"/>
						<unit name="C2" value="0.3" />
					</flow>
				</parameter>
			</node>
			
			<node id="fileout" class="FileOut">
				<parameter name="out_file_name" type="string" 
											value="tmp/sewerout.txt" />
			</node>
			
			<node id="musk1" class="Sewer" />
			
		</nodelist>
		
		<connectionlist>
		
			<connection id="con1">
				<source node="constsource" port="out" />
				<sink	node="musk1" port="in" />
			</connection>
			
			<connection id="con2">
				<source node="musk1" port="out" />
				<sink node="fileout" port="in" />
			</connection>
			
		</connectionlist>
	</model>
</citydrain>
