<?xml version="1.0" encoding="UTF-8"?>
<!DOCTYPE citydrain SYSTEM "file:../dtd/model.dtd">

<citydrain version="1.0">

	<pluginpath path="./libnodes.so" />
	<simulation class="OrderedPipeSimulation">
		<time start="0" stop="7200" dt="300" />
	</simulation>
	<model>
		<nodelist>

			<node id="ConstSource-0" class="ConstSource">
				<parameter name="const_flow" kind="complex" type="Flow">
					<flow>
						<unit name="Q" kind="Flow" value="100.000000" />
						<unit name="C2" kind="Concentration" value="3.000000" />
						<unit name="C1" kind="Concentration" value="5.000000" />
						<unit name="C0" kind="Concentration" value="1.000000" />
					</flow>
				</parameter>
			</node>


			<node id="Sewer-0" class="Sewer">
				<parameter name="N" type="int" value="11" />
				<parameter name="K" type="int" value="300" />
				<parameter name="X" type="double" value="0.1" />
			</node>


			<node id="Sewer-1" class="Sewer">
				<parameter name="N" type="int" value="11" />
				<parameter name="K" type="int" value="300" />
				<parameter name="X" type="double" value="0.1" />
			</node>


			<node id="Sewer-2" class="Sewer">
				<parameter name="N" type="int" value="11" />
				<parameter name="K" type="int" value="300" />
				<parameter name="X" type="double" value="0.1" />
			</node>


			<node id="Sewer-3" class="Sewer">
				<parameter name="N" type="int" value="11" />
				<parameter name="K" type="int" value="300" />
				<parameter name="X" type="double" value="0.1" />
			</node>


			<node id="Sewer-4" class="Sewer">
				<parameter name="N" type="int" value="11" />
				<parameter name="K" type="int" value="300" />
				<parameter name="X" type="double" value="0.1" />
			</node>


			<node id="Sewer-5" class="Sewer">
				<parameter name="N" type="int" value="11" />
				<parameter name="K" type="int" value="300" />
				<parameter name="X" type="double" value="0.1" />
			</node>


			<node id="Sewer-6" class="Sewer">
				<parameter name="N" type="int" value="11" />
				<parameter name="K" type="int" value="300" />
				<parameter name="X" type="double" value="0.1" />
			</node>


			<node id="Sewer-7" class="Sewer">
				<parameter name="N" type="int" value="11" />
				<parameter name="K" type="int" value="300" />
				<parameter name="X" type="double" value="0.1" />
			</node>


			<node id="Sewer-8" class="Sewer">
				<parameter name="N" type="int" value="11" />
				<parameter name="K" type="int" value="300" />
				<parameter name="X" type="double" value="0.1" />
			</node>


			<node id="Sewer-9" class="Sewer">
				<parameter name="N" type="int" value="11" />
				<parameter name="K" type="int" value="300" />
				<parameter name="X" type="double" value="0.1" />
			</node>


			<node id="FileOut-0" class="FileOut">
				<parameter name="out_file_name" type="string" value="tmp/longsewerout.txt" />
			</node>

		</nodelist>
		<connectionlist>

			<connection id="con-ConstSource-0-Sewer-0">
				<source node="ConstSource-0" port="out" />
				<sink node="Sewer-0" port="in" />
			</connection>


			<connection id="con-Sewer-0-Sewer-1">
				<source node="Sewer-0" port="out" />
				<sink node="Sewer-1" port="in" />
			</connection>


			<connection id="con-Sewer-1-Sewer-2">
				<source node="Sewer-1" port="out" />
				<sink node="Sewer-2" port="in" />
			</connection>


			<connection id="con-Sewer-2-Sewer-3">
				<source node="Sewer-2" port="out" />
				<sink node="Sewer-3" port="in" />
			</connection>


			<connection id="con-Sewer-3-Sewer-4">
				<source node="Sewer-3" port="out" />
				<sink node="Sewer-4" port="in" />
			</connection>


			<connection id="con-Sewer-4-Sewer-5">
				<source node="Sewer-4" port="out" />
				<sink node="Sewer-5" port="in" />
			</connection>


			<connection id="con-Sewer-5-Sewer-6">
				<source node="Sewer-5" port="out" />
				<sink node="Sewer-6" port="in" />
			</connection>


			<connection id="con-Sewer-6-Sewer-7">
				<source node="Sewer-6" port="out" />
				<sink node="Sewer-7" port="in" />
			</connection>


			<connection id="con-Sewer-7-Sewer-8">
				<source node="Sewer-7" port="out" />
				<sink node="Sewer-8" port="in" />
			</connection>


			<connection id="con-Sewer-8-Sewer-9">
				<source node="Sewer-8" port="out" />
				<sink node="Sewer-9" port="in" />
			</connection>


			<connection id="con-Sewer-9-FileOut-0">
				<source node="Sewer-9" port="out" />
				<sink node="FileOut-0" port="in" />
			</connection>

		</connectionlist>
	</model>
</citydrain>
