<?xml version="1.0"?>
<!DOCTYPE citydrain SYSTEM "model.dtd">

<citydrain version="1.0">

	<pluginpath path="nodes/libnodes.so.1.0.0" />

	<simulation class="VarDTSimulation">
		<time start="0" stop="7200" dt="300" />
	</simulation>

	<model>
		<nodelist>
			<node id="constsource" class="ConstSource">
				<parameter name="const_flow" kind="complex" type="Flow">
					<flow>
						<unit name="Q" kind="Flow" value="3.0" />
						<unit name="Scheiss Grusigs Michi" kind="Concentration" value="0.0"/>
						<unit name="Ei" kind="Concentration" value="10.0"/>
					</flow>
				</parameter>
			</node>
			
			<node id="fileout" class="FileOut">
				<parameter name="out_file_name" type="string" value="tmp/test-vardt.txt" />
			</node>
		</nodelist>
		
		<connectionlist>
			<connection id="con1">
				<source node="constsource" port="out" />
				<sink	node="fileout" port="in" />
			</connection>
		</connectionlist>
	</model>
</citydrain>
